{"format":"BIFROST-CORE-PROVENANCE-1","mihomo":{"patch_digest":"a493ba0abe3182116beec13fa5abc892411ae0b8d61e5796897c9a36a0e13917","patch_path":"build-inputs/core/mihomo-NO-PATCH.txt","source_digest":"ee8a7107707e4bd485460139b1944e7be30016393783f2b4e928c14880c8ca8b","source_path":"build-inputs/core/mihomo-v1.19.30-source.tar.gz","version":"1.19.30"},"overlay":[{"bytes":160,"path":"build-inputs/core/mihomo-NO-PATCH.txt","sha256":"a493ba0abe3182116beec13fa5abc892411ae0b8d61e5796897c9a36a0e13917"},{"bytes":4581,"path":"repos/bifrost-infra/scripts/libbox-xray-bridge.go","sha256":"595c545237f8732a1782df274d598beff1b4551a1ae4d878a6c69d4cabbaf7a2"},{"bytes":1643,"path":"repos/bifrost-infra/scripts/sing-tun-gvisor-filter_bifrost.go","sha256":"0000ce99c9ac5e0c0a923ea7419d20b8c34af396537a62545b58045463ab671c"},{"bytes":5607,"path":"repos/bifrost-infra/scripts/sing-box-tproxy_bifrost.go","sha256":"5fc360abd1ac12d73ec56529043815e8569a836b268b9ac9bdf2b2e5171000c5"},{"bytes":695,"path":"repos/bifrost-infra/scripts/sing-box-tproxy_bifrost_test.go","sha256":"2ff84ec3c7cb5e6f4d57863595e96d50ceb021d80fdd7d39add755d04a0b8b92"}],"patches_digest":"b2434a588a3ab3f3e727c6a136404649394741b3240764737a174c2183b23dc3","source_archive":[{"bytes":1228535,"path":"build-inputs/core/mihomo-v1.19.30-source.tar.gz","sha256":"ee8a7107707e4bd485460139b1944e7be30016393783f2b4e928c14880c8ca8b"},{"bytes":23264,"path":"build-inputs/core/meta-rules-dat-4178770badecb1b349fbcd62c737e0d7a2079729.tar.gz","sha256":"6e8d87b0439cfe46618a55f0d8c90fea07450c59f586d1dab48d920f2e5db0a0"},{"bytes":4894720,"path":"build-inputs/core/sing-box-v1.13.16.tar","sha256":"0f595ab0b87ff71acd7d4aacd111b2ff4a53a6c1384be285c35a9e88ccc387d6"},{"bytes":4782080,"path":"build-inputs/core/xray-v1.260327.0.tar","sha256":"fdef7d411c11f9b43468597db73bad3eacab855fe190e424e62868e210c21f84"},{"bytes":2672640,"path":"build-inputs/core/sing-tun-3a09076491df-bifrost-detach.tar","sha256":"914f3a6d86d9ba59f254aeb933e7f6a823b763e28861095a53cb9dab6f17fa1e"}]}
